,word,context,label,is_equivalent
46,мера,"В ближайшее время в Москве закроют подъезд любого транспорта, кроме общественного, к нескольким станциям метро, пишет в среду ""ГАЗЕТА.GZT.RU"". Уже сейчас ограничен доступ частного автотранспорта к станции метро ""Тушинская"", а вскоре такие же меры будут приняты возле станций ""Планерная"" и ""Речной вокзал"". По мнению чиновников, пространство около этих станций заполнено припаркованными частными автомобилями, которые мешают подъезду пригородных рейсовых автобусов. Чтобы решить эту проблему, в дальнейшем в районе этих станций будут построены транспортно-пересадочные узлы. Это будут здания из нескольких этажей над и под землей, своеобразные мини-вокзалы, где будут не только билетные кассы и турникеты для прохода пассажиров к автобусам, но предприятия торговли и сервиса. Под землей планируется расположить ""перехватывающие"" парковки для приехавших в Москву автолюбителей - как обещают чиновники, бесплатные. Жители соседних домов также сумеют воспользоваться этими парковками для ночного хранения своих машин. План устройства таких парковок принят в июле 2005 года на заседании столичного правительства. Строительство транспортно-пересадочных узлов планируется завершить к 2007 году. Возведение первого из них - на месте стоянки общегородского транспорта около метро ""Планерная"" - начнется осенью 2005 года.",2.0,0
47,мера,"Ученые выяснили, что закрытые окна и включенный кондиционер при нахождении в пробке максимально усиливает воздействие токсичных химических веществ на здоровье автомобилиста. Об этом сообщается в журнале Environmental Science: Processes & Impacts. Исследователи обнаружили, что высокая концентрация токсичных веществ обеспечивается благодаря тому, что воздух за пределами машины гораздо грязнее, чем внутри. Включенный кондиционер засасывает токсичные соединения внутрь. Кроме того, при остановке машин на красный свет, они проходят сквозь различные ездовые циклы — холостой ход, разгон и снижение скорости. Одновременно на светофоре скапливаются другие автомобили, выбрасывающие новые токсичные соединения. В результате в воздухе накапливаются вредные вещества, которые очень медленно развеиваются. «Если это возможно, держите окна закрытыми и не включайте кондиционер. Также увеличивайте расстояние между вами и машиной, которая стоит перед вами», — рекомендует ведущий автор исследования Прашант Кумар (Prashant Kumar). Эти меры снизят контакты с ядовитыми газами на 76 процентов. Всего в Европе (по данным Всемирной организации здравоохранения) только в 2012 году от загрязнения воздуха погибло более 400 тысяч человек. По подсчетам ученых, водители, остановившиеся в заторах, подвергаются в 29 раз более интенсивному воздействию загрязняющих веществ, чем те, кто едет по дорогам, даже с небольшой скоростью. ",2.0,0
48,мера,"Росаэронавигация намерена с 1 ноября увеличить сборы с российских авиакомпаний в 1,9 раза. Зарубежные перевозчики станут платить больше с 1 января 2007 года, однако точный размер тарифа еще не утвержден. Цены на авиабилеты от этой меры вырастут на 60-70 рублей. Такое мнение высказал глава Росаэронавигации Александр Нерадько. Об этом сообщает ""РБК Daily"". Сборы ведомства пойдут на внедрение нововведений в аэронавигации и увеличению безопасности полетов. По словам Александра Нерадько, реализация специальной программы потребует около 280 миллиардов рублей – 156 миллиардов на модернизацию наземного сегмента, а остальные средства – на оснащение самолетов современным оборудованием. Нерадько также обратил внимание, что новые системы позволят авиакомпаниям в будущем экономить топливо. Он заявил, что после внедрения современного оборудования посадка самолета  аэропорту будет занимать на 15 минут меньше, что позволит сократить затраты на рейс. Об этом сообщает ""Время новостей"". Программа инвестиций в аэронавигацию предполагает три этапа – до 2008, до 2015 и до 2025 года. По словам Нерадько, только к последнему сроку российская система полностью интегрируется в мировую. Росаэронавигация в сентябре 2006 года объявила борьбу с теми авиакомпаниями, которые не платят за обслуживания. В итоге федеральное агентство прекратило обслуживание чартерных рейсов четырех перевозчиков и пообещала сделать то же самое и с регулярными рейсами.",2.0,0
49,хвост,"Ярославская строительная компания ищет кошек на должность прораба-обживателя с зарплатой в 15 тысяч рублей. Вакансия была размещена на портале SuperJob. «Работа предстоит несложная и непыльная, ежемесячно придется обживать 30 построенных домов для счастливых жителей Архангельска, обладателей новеньких коттеджей и таунхаусов», — отмечается в объявлении. В качестве кандидатов будут рассматриваться только архангельские коты весом не более 15 килограммов. Животное должно быть здоровым, ухоженным и не иметь вредных привычек. Со своей стороны работодатель обещает комфортные условия для проживания, ежегодный оплачиваемый отпуск, полный соцпакет, бесплатное молоко и свежий кошачий корм. В августе аналогичная вакансия была открыта в Нижнем Новгороде. Там котам обещали оклад в 20 тысяч рублей в месяц. Обязательным условием для трудоустройства являлось наличие усов, четырех лап и хвоста.",6.0,0
50,хвост,"Мировой суд Тверского района Москвы на трое суток поместил под арест студента МГИМО Сурхо Тарамова, который в ночь на 12 октября подъехал на машине к могиле Неизвестного солдата. Об этом 15 октября сообщает РИА Новости. Арест является наказанием за нарушение, предусмотренное статьей 19.3 Кодекса об административных правонарушениях (неповиновение законному распоряжению представителя власти). Ранее сообщалось, что на Тарамова также наложили штраф в сумме 4,5 тысячи рублей. Тарамов, находившийся за рулем внедорожника, въехал на территорию Александровского сада в 23:50 11 октября. Сотрудники милиции пытались остановить автомобиль, но им это не удалось. Внедорожник пришлось некоторое время преследовать. Остановили его лишь на Цветном бульваре. Выяснилось, что помимо Тарамова в машине находились 20-летний москвич, 18-летняя жительница Химок и 17-летняя приезжая из Саранска. 13 октября на сайте МГИМО появилось сообщение, в котором говорилось, что Тарамову еще 8 октября было направлено уведомление об отчислении из вуза за неуспеваемость. Также в сообщении отмечалось: ""Поступок С.С. Тарамова заслуживает, безусловно, нравственной оценки: общественное мнение МГИМО(У) возмущено его поведением и не допускает иного толкования этого инцидента"". Однако позднее заместитель ректора МГИМО Валерий Воробьев сказал корреспонденту газеты ""Московский комсомолец"", что у Тарамова остается шанс восстановиться в вузе. По словам Воробьева, для этого молодому человеку нужно лишь ликвидировать все накопившиеся ""хвосты"". Как стало известно журналистам, отец Сурхо Тарамова - бизнесмен из Чечни Супьян Тарамов. Он владеет крупным пивзаводом и занимается строительным бизнесом. Во время второй чеченской кампании Тарамов-старший возглавлял народное ополчение в Веденском районе Чечни, выступая на стороне федеральных войск.",6.0,0
51,хвост,"Коди Смит-Макфи выбран на роль Ночного Змея в блокбастере «Люди Икс: Апокалипсис», сообщает Variety. Ранее стало известно, что главные роли в новой серии франшизы сыграют Майкл Фассбендер, Дженнифер Лоуренс и Николас Холт. «С радостью приветствую Коди Смита-Макфи в составе ""Людей Икс: Апокалипсис"". Он сыграет молодого Ночного Змея», — объявил в своем Instagram режиссер Брайан Сингер. Ночной Змей — мутант немецкого происхождения, обладающий сверхчеловеческой ловкостью и способностью к телепортации. Его физическая мутация включает синюю кожу, трехпалые руки и ноги, желтые глаза и подвижный хвост. Кроме того, персонаж, исповедующий католичество, известен своей набожностью. Он уже появлялся на экранах в «Людях Икс 2», где его сыграл Алан Камминг. Действие «Людей Икс: Апокалипсис» разворачивается в 1980-х. Актеры Патрик Стюарт и Иэн Маккеллен, играющие во франшизе пожилых профессора Ксавьера и Магнето соответственно, в картине не появятся. Премьера ленты назначена на 27 мая 2016 года. Смит-Макфи известен ролями в «Дороге», «Впусти меня» и блокбастере «Планета обезьян: Революция». В 2015 году 18-летний актер также появится на экранах в вестерне «Медленный запад» и сериале «Галлиполи».",6.0,0
52,хвост,"По итогам первой сессии дети, получившие высокий балл на ЕГЭ, оказались успешнее своих сокурсников, поступивших в вузы по итогам профильных олимпиад. Такой вывод был сделан экспертами Рособрнадзора. Подробнее о результатах проведенного ведомством мониторинга ""Российской газете"" рассказала его руководитель Любовь Глебова. Сотрудники Рособрнадзора анализировали результаты студентов, поступивших летом 2009 года в РГУ нефти и газа имени Губкина, РГГУ, Удмуртский госуниверситет, Московскую медицинскую академию имени Сеченова, Академию народного хозяйства при правительстве РФ, Кубанскую и Ростовскую медицинские госакадемии, Финансовую академию при правительстве РФ, Высшую школу экономики и МГУ имени Ломоносова. В общей сложности по итогам первой сессии из этих вузов было отчислено около 350 человек. Из 334 человек, имеющих задолженности, 250 - это олимпиадники и только 129 - ""высокобалльники"" по итогам ЕГЭ (Глебова не уточнила, сколько всего студентов имеют ""хвосты""). По словам Глебовой, среди отчисленных не очень много детей, получивших высокие баллы на ЕГЭ - многие критики отмечали, что этот экзамен необъективно оценивает знания выпускников. Руководитель Рособрнадзора подчеркнула, что средний балл студентов по итогам сессии примерно соответствует количеству баллов, набранных на ЕГЭ (после пересчета из стобалльной системы в пятибалльную). С другой стороны, эксперты установили, что студенты из регионов с подозрительно высокими результатами ЕГЭ вылетают из вузов чаще других. К таким регионам относятся, например, Карачаево-Черкесия и Кабардино-Балкария. Единый государственный экзамен стал обязательным для всех российских школьников с 1 января 2009 года. Именно на основе полученных на нем баллов вузы страны набирают студентов. Однако сохранился и другой способ поступления в институты и университеты - олимпиады по профильным предметам. Их победители освобождаются от необходимости предоставлять в вузы результаты ЕГЭ.",6.0,0
53,хвост,"В пятницу, 17 октября, главе российского правительства Владимиру Путину подарили собачий ошейник с навигатором системы ГЛОНАСС, сообщает ""Интерфакс"". Премьер-министр надел ошейник на своего лабрадора по кличке Кони. Ошейник с навигатором принес на совещание к главе правительства вице-премьер Сергей Иванов, курирующий вопросы развития системы ГЛОНАСС. Иванов напомнил, что еще минувшим летом обещал подарить ошейник для Кони. ""Справедливости ради надо сказать, что он был для этого готов. У нас просто не было возможности встретиться с вами и Кони и сделать этот подарок"", - пояснил вице-премьер Путину. Сообщается, что ошейник с навигатором весит всего 170 граммов. Как рассказал генеральный директор - генеральный конструктор РНИИ космического приборостроения Юрий Урличич, присутствовавший на встрече, прибор представляет собой модуль ГЛОНАСС-GPS. ""Это плата, которая находится внутри. Весь остальной вес - это фактически аккумулятор"", - пояснил разработчик. По его словам, таким прибором будут снаряжаться служебные собаки в МЧС, которые ведут поиск людей в завалах. Сергей Иванов со своей стороны отметил, что ""ноу-хау"" этого прибора заключается в том, что ""когда собака на месте, не двигается, допустим, легла, извините, в лужу где-нибудь в лесу, тогда батарейка не работает, то есть происходит экономия энергии"". ""Но у меня собака не поросенок, она в лужу не ложится"", - ответил Путин. Разработчики прибора разъяснили, что в ошейнике есть специальный датчик движения, который отключает навигационную систему для экономии энергии. Премьер-министру продемонстрировали, как при помощи устройства фиксировалась небольшая прогулка собаки на лужайке перед домом. На замечание Иванова о том, что Кони, оказавшись в ошейнике, ""загрустила"", Путин заметил: ""Ей нравится. Хвостом бьет, значит - нравится"". Первый советский спутник ГЛОНАСС (Глобальная Навигационная Спутниковая Система) был выведен на орбиту в 1982 году. В 1993 году система была официально принята в эксплуатацию. В 1995 году спутниковая система состояла из 24 космических аппаратов. Сейчас на орбите присутствуют 14 действующих навигационных спутников. Ожидается, что до конца 2011 года численность орбитальной группировки будет увеличена до 30 космических аппаратов.",6.0,0
54,хвост,"Следующая публикация секретных документов на скандальном сайте WikiLeaks будет касаться всех актуальных проблем всех стран мира. С таким заявлением 28 ноября выступил основатель ресурса Джулиан Ассанж, сообщает Agence France-Presse. Ассанж отвечал на вопросы иорданских журналистов по видеосвязи. Где он находился во время интервью, неизвестно; основатель WikiLeaks сказал лишь, что ""Иордания не лучшее место, чтобы находиться, когда ЦРУ сидит у тебя на хвосте"". По словам Ассанжа, грядущая публикация станет своеобразной дипломатической историей США и будет состоять примерно из 250 тысяч документов. Ожидается, что материалы на сайт могут выложить уже в воскресенье, 28 ноября. Как сообщалось ранее, США уже предупредили своих международных партнеров о том, что секретная дипломатическая переписка с ними может быть обнародована. В СМИ уже высказывались предположения относительного содержания нового ""слива"". Так, в документах может говориться об участии турок в иракской войне на стороне ""Аль-Каеды"" и о поддержке Курдской рабочей партии со стороны США. Российские СМИ писали, что в конфиденциальной переписке содержатся оценки политической ситуации в России и ""нелицеприятные характеристики"" ряда российских лидеров. По данным газеты The Sunday Times, в текстах могут содержаться и антиисламские высказывания дипломатов США и Великобритании. Известно, что часть документов касается Франции. Ранее Ассанж обещал, что благодаря его разоблачениям произойдет ""переосмысление мировой истории"".",8.0,0
